<?xml version="1.0" encoding="UTF-8"?>
<!DOCTYPE conditions SYSTEM "./DTD/conditions.dtd">
<conditions>
    <phi>
        <and>
            <term> assembled(couch) </term>
            <term> moved(couch) </term>
        </and>
    </phi>
    <psi>
        <and>
            <term> assembled(couch) </term>
        </and>
    </psi>
</conditions>